{"schemaVersion":2,"contract":"wallet-capital-list","requestId":"request-synthetic","asOf":"2026-10-14T08:00:00+00:00","items":[{"movementId":"capital-synthetic","walletId":"wallet-synthetic","economicEventId":"capital-event-synthetic","ledgerTransactionId":"capital-ledger-synthetic","kind":"deposit","assetId":"asset-usdt-synthetic","amount":"125.25","occurredAtUtc":"2026-10-14T08:00:00+00:00","knownAtUtc":"2026-10-14T08:00:00+00:00","publicationSequence":2,"reason":"Synthetic external capital","recordedByUserId":"user-synthetic","source":"userDeclaredPaperCapital","ledgerPolicyVersion":"paper-wallet-capital-ledger-v1"}],"nextCursor":null,"publicationWatermark":2,"snapshotCursor":"synthetic-capital-snapshot"}
